Name,Address,Borough,City,State,Website
Carribean Women's Health Association,3512 Church Ave,Brooklyn,New York City,New York,http://www.cwha.org/
Life of Hope,1377 Brooklyn Ave,Brooklyn,New York City,New York,https://www.lohnyc.org/
The Bronx Health Link,851 Grand Concourse,Bronx,New York City,New York,https://www.bronxhealthlink.org/
"Northern Manhattan Perinatal Partnership, PICHC Initiative",127 W 127th St,Manhattan,New York City,New York,https://nmppcares.org/
Public Health Solutions - Queens Healthy Start Partnership,90-04 161st St,Queens,New York City,New York,https://www.healthsolutions.org/community-work/family-support/home-visiting-programs/healthy-start/
Staten Island Partnership for Wellness,444 St Marks Pl,Staten Island,New York City,New York,http://sipcw.org/